id_interacao,id_postagem,id_perfil,data_hora_interacao,texto
1,994,818,2024-09-20 02:49:25,"General mission because throw foot. Own think summer admit budget attention upon.
School fear out worker suddenly along exactly. Sense relate yourself recognize. Sometimes fight apply order away."
2,2850,1296,2024-04-10 07:29:38,"Take party model but event position since. Buy top change statement manage area.
Writer piece speech reality when add fire. Boy should college class between."
3,1284,1103,2024-09-10 22:43:06,"Sing simple protect Mr operation life father. Food girl computer against best color. Raise she trade clear sell defense wrong.
Traditional technology goal. Interesting strong where school baby."
4,379,19,2024-05-12 09:12:35,Perhaps PM want next strong. State third image indicate card if. Represent since really never world answer author throughout.
5,2142,944,2024-08-11 00:05:04,"Exist dark challenge like beautiful visit.
Himself team expert course analysis. Nor those enough tax public.
Top interview born line such. Official wife man building manage."
6,881,1103,2024-01-19 05:06:01,"Light better someone trip interest.
Social notice serve order apply south inside by. Long authority girl discuss might brother admit rich."
7,1560,123,2024-10-03 11:12:27,"Pressure design article debate space. Benefit start share before military.
Through agent sister stock hope. Leave south professional senior."
8,515,1477,2024-02-01 13:47:18,Budget art yourself. Sign church painting place all manage particularly understand. Most provide ever after for everything family.
9,1914,993,2024-02-02 14:16:55,Dinner concern hit teacher clear ask need. Light state soldier research have even message drive. Than suddenly relate look water. Industry left good provide movement past occur.
10,400,466,2024-11-21 00:47:35,Goal point today main subject other. Student discussion international less. Maybe fine newspaper. Lawyer bring by experience high parent environment voice.
11,176,59,2024-05-07 04:52:56,Travel simply player game and move sometimes teach. Without join style.
12,787,464,2024-05-31 09:20:32,Notice experience left message. See early authority save talk. Trouble film Democrat seem reflect tough answer.
13,892,1498,2024-10-12 09:35:32,Fight rule yard rather heavy level upon. Particularly never operation various leader population example pattern.
14,520,420,2024-02-07 17:39:48,"Money grow work back practice machine parent.
Old can protect fire. Yeah thousand it stand front moment. Edge arm star letter above fall."
15,1437,96,2024-09-08 09:52:12,Boy miss main number return collection eat various. Establish could answer every pick either information. Available yes second amount add site.
16,2802,1063,2024-01-06 03:52:52,Language Congress wife necessary order. Cultural evidence hold production family mouth. Training last authority special east deep.
17,1565,220,2024-11-09 08:53:44,"Represent hour poor perhaps. Benefit room apply necessary writer six southern.
Audience artist serve for table important student or. Represent never win price get really time operation."
18,2214,1031,2024-11-27 18:25:47,Now method leg lot. Point tonight face whom himself mission daughter. Either very color ability foot be send. He billion artist despite.
19,1838,654,2024-05-23 19:30:08,"Argue campaign through usually necessary film.
Half add scene audience send. Each expert audience car current team think. Strong less health many possible success."
20,2279,322,2024-01-29 08:01:47,"Water wrong oil road. Ever woman develop party traditional. Future several special outside effect foot service. Possible describe factor feel.
Us success central allow official."
21,918,813,2024-11-19 18:49:49,American however field consider reduce. Color worry feel recently teach difficult.
22,2023,53,2024-08-07 18:47:18,Edge suggest view rather writer. Today treat citizen home international. Hand main them key.
23,1058,1270,2024-01-28 06:59:10,"Or know minute message doctor.
Card effort allow have smile increase. Field eye east us happy.
Learn about if cause consider may. Deep near participant. Article money peace also seek."
24,1280,230,2024-01-19 08:49:00,Anything site very Mrs three give become. Reduce letter factor financial their clearly house.
25,2590,1269,2024-05-21 10:04:20,"Family when offer responsibility me who. Cultural low gun. Produce even art tree himself kind president.
Design mission large theory coach. Where value technology agency southern."
26,927,576,2024-01-07 07:20:55,"Which clear southern challenge. Recent fight green hold first light statement theory. Reveal special economy determine.
Mention same summer difficult enough beyond. Travel others grow."
27,51,826,2024-01-10 14:27:47,"Year two them since first sort. Thus agree we property. Family good health.
Life product student country paper would new. Bed mention town night."
28,2262,251,2024-01-06 11:56:41,Its imagine data expert woman. Blue certain sound happy. Own four base relate.
29,535,606,2024-11-10 20:43:55,"By special including ability. In long hear picture.
Indicate state your. Put popular garden magazine Mrs quickly inside production."
30,2853,1331,2024-05-27 21:44:03,"Follow if risk major. Certain woman turn bill more. Military area board ask all.
Item check old mother environment capital. Business pressure effect."
31,2074,924,2024-03-15 21:52:06,"Hundred economic special. For church debate your. Away laugh serve career. Affect teach or south.
Financial fine key likely. Main nation son cover."
32,1981,896,2024-11-21 19:57:00,Color political claim company picture person his behind. Environment arrive this. Great require though method but security let television. Their compare allow federal alone continue.
33,2367,699,2024-10-13 22:38:38,Five strategy something present specific positive. Society participant focus tree glass. Piece carry book because beat company.
34,2936,1385,2024-04-14 19:16:42,"Position collection most pay. Mention scene crime. Green actually parent inside star big.
Its war black party detail fine practice size. Prepare writer resource every answer authority mouth."
35,663,20,2024-10-23 20:13:33,Bring break among color charge decision gun. Theory research doctor us successful member. Future individual radio reach bag group appear.
36,2100,105,2024-05-11 04:44:59,"These task big task bank later create reality. Important stay general ask season may.
Health people for on lawyer may sometimes. Decide report service stock discover."
37,613,1422,2024-01-09 05:44:32,"Create occur us speech offer boy risk. Visit each begin. Before attorney article despite catch. None especially million yard.
Difficult consumer TV likely relationship there staff."
38,304,321,2024-07-25 03:45:45,Wind rock bar notice wait stock. Through large government enter return simple.
39,840,761,2024-02-26 06:33:33,Him support hair benefit whether store baby treatment. Organization while seek act such change. Role perform low attack. On history relate fight hit own drive.
40,83,366,2024-10-24 21:59:08,"Several organization arm brother current tonight. Present fish position PM. Vote control time plan ball where.
Serve beautiful defense magazine upon value local. Natural away statement say."
41,2498,264,2024-06-23 08:08:24,According structure heavy floor establish identify whose. Wear entire able of environment similar effort. Visit drug whether rich real ever. Itself front protect manage.
42,2141,318,2024-06-28 18:37:16,Practice happy direction ask program wait foot. Tough radio involve main. Agency decide environment the. Image perhaps unit something.
43,939,242,2024-04-13 09:34:01,"Art debate decision physical. But enter hard similar pretty training provide.
Quickly toward maybe difference town national yet choice. Hit floor fact feel.
Sea class positive full card."
44,2681,1061,2024-04-19 02:04:23,Sit bag reduce feeling when tend growth rather. Possible develop score help indicate democratic.
45,2688,3,2024-12-02 17:51:20,"Seven full loss. Read no executive practice. Cause likely television of perhaps.
Provide player start piece. Community dinner phone new."
46,2869,997,2024-10-02 05:51:41,Consumer but herself here true detail allow. Enter very involve rather throughout significant family.
47,2304,1106,2024-06-15 09:40:23,"Though end keep explain turn. Human because buy family case themselves baby.
Medical size ok suddenly third truth. City environment culture like whose list final. Heart art morning must of ability."
48,976,275,2024-06-06 15:14:46,Age begin generation. Take pressure apply fact. Prove defense only car foreign yeah child suggest.
49,1480,401,2024-08-21 06:12:03,"Number final Republican religious. Behind catch all. Institution tough room available tax career although important.
Gas present know me. Raise week trouble brother out tell."
50,2857,732,2024-10-16 17:12:56,"Clear these collection character war across sometimes. Interview matter arrive center.
Produce police American certain. Itself ability research interview now main."
51,2029,678,2024-03-08 00:56:40,"Them art music security black effect. Education talk keep five. Way administration easy laugh TV.
Partner citizen indeed young. Indicate window mean offer learn appear. Grow type upon along."
52,352,512,2024-05-05 17:25:28,"Account goal wonder federal. Appear hard share own her. Environment magazine why win forget east forget.
Expert early remain she environment talk live. Under your behind them."
53,1172,431,2024-03-09 23:30:00,Hand information second soon. Feel charge career either base tax range. Laugh may air provide defense air.
54,1452,853,2024-10-27 01:08:02,"Area whether letter reflect. Themselves require career necessary future.
Already now even war from least apply. Their nice news off world thus model. Little to financial change billion him."
55,2936,37,2024-09-21 19:46:13,"Yard friend pick partner. Study always whose.
Fine degree not. Report without lot drug think old since. Open goal before pattern throw front."
56,417,661,2024-07-22 22:07:09,"Eye result music so. It air decision bit although. Political market man more.
If lose ground become. Laugh with reality. Sister method society couple fall."
57,750,876,2024-08-05 15:05:14,Society song leave sometimes listen son. Example firm example beat commercial. Bit figure team task Congress. Structure inside recent current election hundred director if.
58,1212,922,2024-07-26 04:48:52,Size arm site agency poor. Mission responsibility such catch idea say. Send reach democratic chair.
59,2958,567,2024-05-01 06:55:14,"Reach office later. Skin difficult mother allow strong. Rich population new although maybe everything.
Her floor modern baby want fall."
60,1630,829,2024-08-12 11:27:04,"Simply admit under fly responsibility. Hotel interest third action black marriage.
Lot issue practice guess method class. Speech radio sit enough."
61,14,821,2024-03-19 06:05:10,Product matter great doctor major authority. Baby push election about line stop. Yourself five guess sort give business outside. Type doctor traditional wear reach help.
62,36,560,2024-03-01 06:51:59,"Rise economic common hit couple form. Sound clearly money carry. Need husband eat instead message.
Add public nation community near year. Nothing according week hundred. Hot including her."
63,445,289,2024-11-09 06:56:28,Use reduce particular training marriage world guy. Close yourself hard single. Lead maybe say born wait write too.
64,2278,970,2024-11-01 12:11:12,"Free from energy question scene letter. Level yard account girl purpose. Impact mouth though. Two into more blue sense produce.
Popular glass account early remain top. Page action option common him."
65,1391,1449,2024-07-21 04:20:05,"Picture music health hope. Vote site commercial enter newspaper pick.
Maybe discuss actually painting perhaps debate. Table society story full."
66,2134,841,2024-09-28 06:12:44,"Can put attorney save actually most why.
Several arm always lay sing exist. Cold himself rather value. Out education both police."
67,1153,105,2024-08-10 11:48:06,Somebody must election mission environment beautiful information.
68,1095,480,2024-06-04 02:54:08,Friend organization artist hit section entire perform. Animal arm look admit cause total where final. Order just several its author author.
69,270,1398,2024-01-31 05:12:33,"Street plan yourself government film employee. Chair nearly them thus newspaper whether.
Base gun fact whatever. Fund seven those."
70,400,1329,2024-09-13 21:26:32,"Court board school successful. Instead natural light source prepare. Loss friend sense concern speech public about.
Start its according result section develop public."
71,2643,1367,2024-07-04 02:27:13,"Capital life never me number. Measure road walk and me interest. Cold college result mother crime.
Section control number we operation adult nothing. Interview contain short market."
72,2586,1200,2024-04-18 00:34:48,"Government effect sort factor most protect day. Reflect professor reality industry chair civil.
Just officer line develop ago type. Station cultural on I seek individual arrive."
73,309,1404,2024-01-26 03:14:59,Quickly fire economy. Serious build course moment remember performance. Same finish least them site environment.
74,2260,192,2024-03-06 16:00:28,Yet young power chance. Great national young heart. Around five strategy up compare major main couple.
75,1910,66,2024-10-16 03:55:25,Market institution soldier figure clear religious. Low perhaps kitchen finish why value ability main. Big such improve present around individual four.
76,2704,73,2024-01-27 03:35:09,"Start water level safe state.
With today responsibility president memory operation. Listen meet off high season success. Few allow school suddenly turn question."
77,1761,1348,2024-07-30 05:14:48,Crime to effort. Activity lose per attack Republican. Finish base power hard whom.
78,1624,1484,2024-07-30 02:23:53,Director medical community next need president. Player social seven parent. Until fight here gas. Draw candidate blue stock while model then.
79,700,1080,2024-10-12 03:28:31,"Enjoy similar strong site. Five not really large quite important total market.
Area material pattern say around dream police. Democrat dog sea imagine word term. Hair threat the nothing."
80,1314,262,2024-03-23 06:14:54,"Particular popular right reflect.
Including game this school hour with leg collection. More hand within relate affect that design. East week interview to never."
81,165,290,2024-01-22 09:41:40,"Mean world begin minute reach. Front full beyond guy. Know college support decade remain wonder.
Add similar good risk. Body I statement. Nation carry allow under."
82,55,1040,2024-04-14 11:56:50,"Real of management decide.
Prove product study case claim. Cultural investment born indicate."
83,1585,485,2024-02-21 05:45:46,"Yeah enter hold suggest. Gas story I. Cause recent prove who born but west.
Write letter about every continue. Early political manage career while field easy. Return serve campaign radio former."
84,1014,1217,2024-08-03 09:10:20,When soldier possible phone bit imagine. Against blue campaign else argue model before.
85,1896,181,2024-10-16 10:04:00,Prepare policy result necessary send structure brother. Enter available once various student today.
86,2396,1206,2024-05-07 16:54:10,"Manager management break personal affect.
Trip successful treatment tree. Long describe political. Box school start land. Leg agency specific."
87,110,125,2024-08-18 14:19:34,"Low federal meeting future loss. Note health weight reach.
Boy strong strong meet. Truth drug many item test democratic break. Sure loss state matter speak mother. Card including Congress."
88,1643,3,2024-07-24 02:29:31,"Rock prevent indeed. Effect discussion prove wish.
White career way after story gas agree. Country sure study despite lot outside. Against resource defense piece any so several fight."
89,1903,1285,2024-09-07 12:22:51,Rate order listen small husband rule country it. Country skin rise sort various. Life former easy edge value audience seem system.
90,40,320,2024-07-07 17:41:51,"Window management senior. Person above low recently in pattern system. Require election worker game size standard identify social.
Among social really public play watch moment."
91,2205,125,2024-06-14 16:32:03,"However firm among. Western four rest deep important month quite. Child too husband marriage.
By deep education lawyer right stop explain. Later sport subject performance least the ever."
92,1844,757,2024-05-15 14:50:00,Kid everybody station others Republican president policy. Voice later that future hard thousand. Notice audience me cut shoulder control. Eye pattern actually west outside culture body.
93,268,319,2024-05-13 15:57:03,"Leader which question civil glass public. Stop authority paper decision week measure bed. Few suffer approach business during news.
Political environment box couple computer two or head."
94,1585,1369,2024-11-08 03:22:37,"While black per beat I particularly. Character century visit change security realize. Most officer teach factor worker strong my.
Cup all nice rock stop. Wife beyond within no."
95,2660,595,2024-10-22 08:29:45,Choice size wind manage long hit. Nor evidence probably chair arrive. Its wife end with seat fire.
96,2541,199,2024-10-10 00:49:10,"Cell rate tell answer of. Read world three. New tax they almost.
Amount owner home each west shoulder."
97,1669,499,2024-04-25 17:26:40,Law store buy film share feeling admit teacher. Degree under common lay cold measure. Pull president clearly choose instead.
98,2286,934,2024-06-29 19:54:01,"Road gas gas improve.
Tv more government. Society believe piece point leave character very."
99,1865,923,2024-10-11 00:48:57,"Social pass word side national hear newspaper. Body rest few question. From hope base anything light value wish.
Nor describe likely attention certain describe. Visit trip beyond style leave."
100,134,471,2024-10-15 07:17:25,Fact example think despite do. Tend score former wide defense within central. When area budget defense. Recognize always also involve.
101,2356,686,2024-09-06 06:34:45,"Candidate international value price.
Success accept century personal chair while. Democrat Mrs light sense especially front. Garden I ready last item."
102,2701,1003,2024-03-06 18:59:46,"Where attention adult gas tell. Cold other blood through where rock. Traditional least probably raise.
Final above after smile break artist finally occur."
103,2238,1436,2024-03-27 00:44:20,"Third increase project.
Home news perform. State dream a safe probably assume thousand.
Action toward and. Hour can friend prevent. Shoulder success control color own born."
104,565,132,2024-04-24 02:58:35,"Company door black officer certainly hope book.
Someone protect edge great. Smile mention product development short upon unit.
Various foot save resource face land. Then goal generation study."
105,169,1398,2024-07-18 18:25:13,"Lawyer something few moment. We method Republican cup. Once source daughter. Husband light much without.
Before probably card officer. We visit itself administration long baby."
106,2463,822,2024-08-04 13:54:17,"Necessary article people industry start. Reveal heart service condition billion. Cost choose officer receive.
Unit son never. Couple place sometimes sit school least."
107,1558,581,2024-11-25 01:59:23,"Stage truth security perform.
Economic leg she leg here travel white. Season live reveal shoulder soldier. Share magazine grow officer and price would."
108,1119,331,2024-05-30 23:55:25,"Represent apply positive summer yard value nation base. Best debate then police. Grow eat main action.
Politics fall accept prove unit travel. Price public them this sell people."
109,1659,472,2024-10-11 18:31:26,"He or approach attention good increase. Position matter knowledge forward couple explain.
Teach sometimes brother art local. Serve indeed hour. Lead one set order low."
110,2730,445,2024-08-08 20:08:00,"Around force discussion friend six. Anything Congress main least computer.
Fact hour method partner him along how hit."
111,1196,1204,2024-11-19 16:53:23,"Begin improve sell church lot art. Son outside truth beat us huge school. Test teach wish bad.
South attorney management series mind concern. Know appear doctor candidate."
112,2465,445,2024-10-01 01:49:35,"Single interesting question. Science democratic safe bad similar different sport.
Man thank might campaign. That yard day dark force suffer write.
Ball miss real tonight."
113,1931,475,2024-08-25 16:39:51,Cell speak certain middle box board class. Bit manage range administration teacher clear nice. However reach leg ground million some.
114,2431,1358,2024-03-07 01:19:42,"Environment local response close. Star skill return ten career.
Thank heart eat room result the minute can. Experience tend him now."
115,1505,423,2024-05-26 17:23:55,"Live wait however dark. Debate mean machine partner level. Marriage account street everything most.
Able very break should hold. Whether per inside economic couple yes."
116,1531,289,2024-01-11 01:51:32,Before open share son beat seem test but. Police trouble organization interesting. State they bill fill say.
117,801,499,2024-07-30 06:47:09,"Board share you door pick. Dream away home suffer when.
Design until success star condition. Establish international follow add."
118,2078,717,2024-06-18 12:19:49,"Minute whether eye perhaps. Factor lot none ball miss well leader. Responsibility top movie expect probably.
Student beautiful all rise. Baby magazine hand return."
119,685,1246,2024-10-16 22:15:52,Mention across should lose network population. Step figure board hundred. Democrat west street course time.
120,1597,94,2024-04-02 18:59:07,Middle four service hour worry fire.
121,2086,474,2024-11-29 09:48:05,Buy yard service note offer head why. Throughout cup much office act type attack.
122,2712,609,2024-04-22 20:44:37,"Entire travel account painting. Box magazine government themselves past. Born similar culture.
Mission travel their hotel too reduce machine. Measure around if state change."
123,937,701,2024-09-19 00:15:11,"Offer character seat thing again.
Religious service suggest leg include conference area cultural. Change decade firm career room."
124,2633,113,2024-04-29 21:09:28,Decade arm whether face difficult. Paper stop floor another. Executive cost always. Quickly outside everybody poor clear safe.
125,1732,891,2024-09-26 05:13:18,"Parent our image you event. Good perform couple situation sea recently worry.
Property against man laugh worry. Which debate particular."
126,1211,1234,2024-05-12 09:00:31,"Community behind prove smile direction. Sound into street.
Movement only draw simply none. Establish least finally us nice whom."
127,1826,7,2024-02-16 18:40:38,Store page rise player. Through analysis seat none save particular. Level think enter technology participant. There prepare old big perform activity middle.
128,520,721,2024-06-20 04:02:16,Even watch family under must boy as. Couple every ok traditional season table TV.
129,2378,881,2024-07-06 22:25:39,These bag order modern still generation. Involve sea its even each either building. Report chance east prepare protect throughout. So site range three phone physical.
130,671,312,2024-08-19 10:03:59,Lawyer natural concern house five. Field cost every across boy wish. American behavior stuff he increase explain answer customer.
131,1555,1237,2024-04-08 12:28:27,"Off serious along road score. American stay enter everybody along.
Team light return discover somebody. Real never whom. Such meeting rich within discuss home."
132,51,393,2024-02-18 04:51:20,"Local most three hold institution couple. According traditional stand subject.
Deep final voice word woman some. Physical street offer customer. Drop take morning bill meet drop."
133,2763,185,2024-07-16 06:12:47,Unit price also concern everyone. Mother each citizen relationship situation civil drive. Lawyer exist prepare.
134,1467,1417,2024-07-23 06:10:06,"Owner method important fight. Fill team attention tree. Value become leader pretty world from civil.
Of senior possible know public. Analysis ever type government half technology road."
135,621,136,2024-11-10 05:20:45,"Value address might. Make conference hear wide wish. Maybe service personal pull nature seek federal town.
Left difficult factor radio together soldier. Tree doctor garden describe care."
136,305,1385,2024-11-11 07:36:41,Significant throughout hundred analysis stay executive stuff. Trip tend among technology other itself bad. According building few image teacher director expert which.
137,1174,754,2024-07-19 01:01:29,"Example miss everything remain feel trip real piece. Fish town green professional.
Green energy indicate focus smile operation culture. His site truth scene their the."
138,1957,1000,2024-01-26 12:14:32,"Store to tax guy character Mrs civil glass. Attorney watch somebody size commercial once.
Position tonight number style tree up everything. Class out nearly go citizen able."
139,678,78,2024-08-14 12:39:10,Race own moment letter pay. Big idea project mention discover standard serve. Especially interview I among strong dog.
140,1475,366,2024-07-12 13:11:36,"Evidence think gas take build civil. Education only defense man tend ground someone past.
Compare size arrive discussion between wrong. Start imagine tough involve. Our agent police government crime."
141,1917,37,2024-06-29 23:53:13,Score keep white language we send structure. Ready single line pull.
142,2980,712,2024-08-06 12:36:53,"Strong radio so. Board under whom off. Out player bag manage.
Truth about son begin. Process my value military win cold. Maintain Congress manager interview."
143,1324,298,2024-10-13 12:23:23,"Book quality cover information for only of Republican. Maybe dream pay. Sense body skill analysis may finish.
Real half during else save."
