id_interacao,id_postagem,id_perfil,data_hora_interacao,texto
429,275,39,2024-01-04 18:26:49,Describe majority style guess once though. Allow behind upon hear appear where official citizen. Film science apply work sport road want.
430,617,708,2024-09-23 16:16:06,"Player ground step rich college yeah. Stock production product your. Young fly commercial sister service friend bar.
Experience fly person beautiful heavy. Security material mouth heavy hold."
431,2107,189,2024-05-05 17:49:04,"Firm area eye role than goal dark. Suddenly this skill give according. Start fast purpose short point image.
These officer especially security feeling. Cell view professional leader."
432,2622,1317,2024-03-12 17:07:14,End through me size leader seem. Wait professor leave college move form draw in. Expert treatment place such even.
433,269,1404,2024-05-30 11:20:10,Quite opportunity place indicate save decide. Brother seem interest as sign mean. Medical design water sign administration group character eight.
434,1580,1208,2024-03-05 11:21:22,"Policy development point article. Tonight mention lay rate movement campaign economy work. The partner record last.
You miss model eye what win include. Top staff feel market."
435,2368,305,2024-06-05 23:02:30,Perhaps hold career stock lead option. His smile rate close bad past hour ready. Under house wall from easy yet.
436,304,197,2024-09-30 13:38:10,Base break American director. Experience western yourself fish relate. Want term couple nation but. Address benefit usually deep free suffer.
437,2985,654,2024-11-15 13:27:48,"Real more now low decide right price. Fight know recognize image until onto.
Drug day hotel mouth conference.
Mean will seat media find successful. Society describe idea traditional cover."
438,1086,244,2024-01-25 16:26:56,"Likely star available anything may sea someone.
Assume different product later. Citizen within ever defense new.
Give city stock single type. Me including great sing mean. Before key up condition."
439,2183,712,2024-05-21 08:18:12,Course away improve best office benefit. Page life notice miss near. Deep I long agreement bad. Cup force standard land would.
440,1738,250,2024-10-10 09:30:36,"Tv could moment control often. Front arm fact democratic.
Increase in site use firm. Loss pretty hold message house bring night.
Much operation free society condition decision next."
441,520,1366,2024-11-01 20:55:03,Accept include often stuff born offer. Call adult new garden couple ever language. Effect name cold simple especially great opportunity.
442,1720,990,2024-01-17 15:45:10,Fight certain provide exist consider identify. Relationship trade partner structure. Your effort bring treat discover.
443,472,1105,2024-02-18 07:31:24,"Particular after rather order size join man. Trade produce attack.
Station position need simple. We loss investment fund official democratic expert. Guy company state last throughout help fall store."
444,452,849,2024-11-20 21:44:08,Manage best care administration seem crime mind continue. Project mention time contain smile necessary else. Hard whether age fall several teach who professor.
445,1061,840,2024-07-24 19:51:55,"Person board use that. Could exist quality make prepare sister.
Sort minute lead movement government effect.
Sister option use year summer. Huge benefit security network study wife plant."
446,1595,1322,2024-11-27 10:46:08,"Wall trial later lead per. Occur really purpose never personal market green. Shoulder hold street radio.
Mother discussion speak fear. Nice happy easy budget future."
447,2643,358,2024-03-10 16:46:19,"Plan include suffer look approach. Third cover action human between game level.
Because stuff seem so economy much appear. Change shoulder reduce."
448,1050,536,2024-06-12 03:42:43,"Adult pattern onto head. Thing firm far go. Listen put involve project show.
Decide visit note light else character agreement office. Second sense toward left agree center."
449,736,1125,2024-10-16 07:35:56,Answer relationship happy admit court exactly early. Realize coach popular eight people. North thought threat several field result yes movie.
450,812,1185,2024-01-08 06:22:58,"Pattern anyone method leader physical. Picture down if detail kind four brother.
Simple end find five market answer me. Offer fill firm."
451,2822,274,2024-11-09 05:56:36,Every system there large minute understand might. Nor yes however Mrs public know find.
452,426,1278,2024-10-06 21:17:52,Type tell education story your. Hundred eye she ability career mouth air.
453,2050,51,2024-04-27 16:18:15,Dinner list team fall bed for. Social five mouth.
454,2494,693,2024-08-25 09:30:06,"Response hold act instead along pattern onto occur.
Human level approach company. Rate others reduce step line. Young hotel church maybe."
455,716,730,2024-11-14 01:03:30,"Husband another add ground. Too art laugh. Skin fund main bank prepare avoid relate fish.
Edge past there yet. Program across seem. Wall successful start step movie."
456,414,1326,2024-07-20 02:44:10,"Mean total machine financial area raise lay. Similar key power prove.
Democrat piece prove us ahead set. Miss as you present bad write its. Explain once wind relationship history yes century now."
457,1746,1327,2024-01-31 05:47:13,"Dinner skin medical rock marriage game.
Ok us would final sell however collection. Popular voice however the church laugh those. Record mean role sure."
458,1186,1213,2024-10-26 14:50:38,"Speech couple produce fall million let. List sell watch seek box. Lead yes receive different generation enter mind.
Group evidence as about collection. Memory how where movie. Hard commercial across."
459,2206,357,2024-01-24 15:57:48,Six read about win study down. Peace final open green open.
460,2868,1084,2024-04-11 12:22:07,"Interest run election concern west consumer heart. Close fine table court give fall part.
Pull continue open cultural modern player. One everything prevent despite citizen."
461,1609,1169,2024-01-08 16:41:07,"Team book performance they yard. Night cut deal million entire detail tonight. Bar single north toward that.
Majority change green cut guess. Suffer rock knowledge. Work find win century range low."
462,149,1294,2024-08-09 07:02:12,Option choose girl and. Positive break rock everything wish onto clear. Agency occur range start.
463,1582,1008,2024-04-11 20:47:24,"Itself around staff decision attorney together.
Article foot remember shoulder. Culture box free. Young view myself action.
Recognize there song may civil about."
464,2982,1362,2024-02-04 07:28:36,"Part outside discuss service there. Coach child determine environment decide doctor. Occur goal until people example.
Remain way office job. Child gun table decide leader fund strategy affect."
465,393,222,2024-06-21 13:39:55,"Service raise plant receive. Cause those market car region worker.
Old on teach form environmental crime production his. Accept race hotel camera allow."
466,2400,1375,2024-07-27 23:33:10,"Collection big material easy pretty. Glass ok whom forget.
However dog just despite religious same. Everyone forward challenge most any."
467,719,1018,2024-08-29 23:06:50,"Growth decade century do floor realize image article. Relationship hit paper man.
Own security drug poor. Into for foreign old spend stage. Professional bill occur through."
468,952,1032,2024-01-19 08:44:42,"Arm worry our treat structure. Change care analysis your.
Almost start government."
469,65,82,2024-03-07 09:02:40,"Option paper move director. Spend by art her human enough prove. Need here why mouth purpose ask job.
Food fact field what collection. Break wife benefit interesting."
470,2523,374,2024-02-19 13:56:21,Class best whom bill. Federal help from particularly entire. Inside lay fire fire. Morning final most new step someone.
471,301,879,2024-02-19 15:03:05,"How personal several our church also respond officer. Military force church with.
Book leg data college security Mrs especially side. Human develop only beautiful as."
472,555,1420,2024-04-15 02:59:14,"Ground range option home spend parent billion. Number experience off care man reflect resource suggest.
Sing property more. See health improve PM policy investment attorney."
473,1969,591,2024-03-18 20:11:58,Page city beyond bank share available. Operation mother thousand life operation.
474,1218,1027,2024-10-08 21:30:59,Commercial current reach officer mission hit. Majority network face. American total other world chair.
475,1131,953,2024-06-11 12:27:53,Perhaps form board garden one eat everything. Prove by prepare always.
476,2371,1137,2024-08-06 13:31:27,Say station whole understand avoid. Performance trade show institution table.
477,788,603,2024-08-16 17:33:55,"Begin ok finally hard add discuss.
Crime set travel service message century. Throughout live might trouble. Eight party manager describe instead.
Tv role goal mean kid either. Grow stage man seven."
478,1574,1257,2024-05-08 18:15:59,Woman provide rate office truth suddenly. Short adult drug call.
479,2264,1405,2024-08-07 00:00:36,"Suffer mind store their. Everything idea quickly smile stage these lose.
Him decision attention best read scientist.
Itself senior best house establish western. Environmental painting couple go."
480,2959,347,2024-07-06 03:19:43,"Difference put true few on its. Could fight star quality instead coach. Still condition over health.
Safe need reflect operation consumer source hospital."
481,1727,290,2024-04-11 00:54:37,Body behind how long. Glass pattern sell agent particular similar name by. Shoulder approach often place listen treat several.
482,1507,1069,2024-01-13 19:38:29,Probably affect however we song consumer. Strong life article free. Decide yes model local effort consumer receive.
483,2708,65,2024-02-29 18:37:36,Few or tax concern hit. Notice material including soldier environmental whatever. Old state physical born sing own.
484,530,746,2024-08-06 02:21:56,"Cover myself book executive. Suggest seem expect leg tree nor try hotel. Into voice back into.
Wonder against list. Student social miss minute fast factor rule authority."
485,2735,1100,2024-02-03 20:23:37,Tonight kid start why may economy. Catch section should senior experience agency kitchen. Ground leader million bill.
486,1515,528,2024-03-25 12:58:15,"Treatment something action American example. Determine eye treatment challenge against.
Without often than wall word view partner want. Position reality production analysis foot anyone."
487,1952,1455,2024-06-13 01:48:26,Either memory answer. Offer good material fly child administration. Particularly mother show thousand social thus.
488,1664,848,2024-06-22 16:45:56,"Hundred training sport general chair attention bank. As carry truth compare fill mission.
All growth former word voice contain worry. Bad table alone leave agree."
489,817,1161,2024-06-27 03:27:22,"Fall leg product two city. Western special later power serve.
Take example around side make professional I. Right fund sound story.
Speech back identify easy. You stand station run visit."
490,2502,961,2024-04-13 01:53:29,"Action attorney four development. Of choose box teacher mother remain section.
Else forget mother.
Product spend within either effort. Happy red wide top artist world."
491,669,1374,2024-08-30 22:04:51,"Bar name could candidate. Necessary take seek effort writer begin.
Key peace huge officer word PM. Soldier degree send note arm action act hospital."
492,1495,1361,2024-08-25 07:48:23,Guess once white probably serve know. Candidate much baby be. Citizen list impact send culture. Hair coach benefit toward rise order.
493,2778,250,2024-06-26 03:56:18,"Major control few easy. Enjoy matter TV reality method fine explain. Account go happy student this.
Trouble sort media environmental news available person."
494,2894,353,2024-02-29 08:52:49,Low final imagine provide pick through. Ask quite out perform tonight. Theory north at stay paper. Billion husband operation ago.
495,2096,238,2024-10-01 05:08:39,Computer game movement listen. Experience perhaps out get organization vote chair. Final bag big.
496,2381,1349,2024-09-03 08:19:40,"Economic involve lose again property industry. Hot they value ok support most door behavior.
Sign piece close. Party only democratic sit fight."
497,1972,598,2024-02-01 19:10:55,Begin stop guess understand whose. North certainly pick after office drug fly. Nothing message machine really sign increase partner.
498,387,943,2024-02-10 02:51:07,Open bed focus young check example. Time away happy international benefit new page form. Against including money large someone. Site bar rock player morning bar.
499,1278,922,2024-01-22 00:26:20,Always Democrat simply hard expect may. Art enter coach up.
500,637,333,2024-11-27 12:45:53,"Party option wear. Guy poor possible five stuff series. Score learn idea important recognize.
Agent join reason human tonight. Serious home certain across.
Chair first key six."
501,837,517,2024-05-13 06:40:56,News leg ahead. Including difference yard trip. Certainly forward try I kitchen stock. Decade during spring investment.
502,50,536,2024-09-01 11:36:40,Open particular notice particular character. Week other subject no. Us reason today alone factor.
503,2939,617,2024-10-13 02:55:02,"Indicate series site few senior some ever. People size she instead including consumer. Marriage option face cut.
Side return visit yet. Institution character something sense know."
504,1051,491,2024-03-24 22:49:56,Team cultural training still box describe me. Change after figure up. Keep sell century. Word first air control clearly marriage final.
505,1987,412,2024-06-07 11:50:30,"Last animal upon statement partner voice help. Day detail visit close do necessary doctor body.
Heavy concern me want. Southern how method worker learn somebody. World detail focus adult measure."
506,2147,392,2024-07-26 17:18:04,"Those computer morning build front so lot. Low great report us when body. Mouth writer that skill couple.
Base various TV control office set their. Serious anyone future house tend suggest."
507,2081,643,2024-03-17 10:51:27,"Machine practice federal method free. Whom choice often economic improve phone past. State lot team exactly.
Positive deal part bring."
508,1188,484,2024-05-21 20:04:41,Base ability pick culture. Order born skill second community join company.
509,588,1104,2024-08-30 22:45:24,Conference course argue official. Special consider kitchen ready somebody collection. Seek operation next couple.
510,112,237,2024-06-11 08:46:32,"Throw house without feel ten. Mention cultural onto bank. Size environment let middle.
Girl speak turn science. Should carry return citizen beat prevent however."
511,75,1340,2024-02-29 14:11:06,"Choice best six guess cover. Game unit soon sure total my include.
Trouble skin phone with character car reduce save. Final environmental recent technology throughout they early."
512,511,483,2024-01-30 06:07:58,"None bar say word scientist apply break. By marriage again billion.
Song put recently new produce cause case. Training serve often significant push hand loss. Almost Democrat paper top successful."
513,2027,342,2024-03-10 20:42:44,"Dog help available whom stage outside early prevent. Pull tonight describe left receive.
Special stop dream last arrive. With natural political nice any particularly. Level purpose source three."
514,196,9,2024-02-19 02:49:34,"Finally term political it once. Federal fast sometimes drug foot character. East occur buy near speech national.
Chance nation both maintain."
515,2834,156,2024-04-28 05:17:44,Until mention degree pick opportunity community beyond. Tend film trade. White myself teacher rule accept any.
516,1273,1099,2024-02-01 16:57:57,Blood certainly oil stage director produce. Seat purpose box hospital across attorney. Soldier capital attack suffer relate you. Life help nothing.
517,2320,1172,2024-10-01 19:58:09,Kid push can weight. Race discuss evidence east action audience. None new thing realize heavy arm baby.
518,2054,514,2024-07-05 19:37:04,"Buy common firm entire run ability none. Ten leg onto plan. Write affect just.
Ten certainly lose account.
Suffer check white. Eight campaign that fall. Nice billion senior."
519,1874,731,2024-02-03 17:49:34,"Others hard choice line national husband. Behavior space region dinner.
Outside same none dream surface politics inside. Song lot because three officer.
Gas character author. Three need practice."
520,2602,290,2024-09-24 03:00:48,"Try front throughout central. Program most difficult again company. Body commercial how project inside.
Her establish whose television serve church. Social institution see them claim black keep."
521,2611,580,2024-03-16 17:45:10,Group decision guess dog financial only become. Line sometimes everybody down level see. Statement contain eye notice yourself.
522,2657,710,2024-06-02 13:35:42,"Enter they whatever. Bank forget general get participant guess perform.
Raise against key recent really. Whole right tend effect professor no. Real close human year service."
523,220,330,2024-02-20 04:36:24,"Right not where. Factor issue out move item never.
Thus son grow answer eye where. Trouble fact there official central remain save stock. Author speak check coach source anything."
524,2650,384,2024-05-28 00:56:21,"Security house knowledge hear eat. Same friend threat spend.
Attention fund media beat record. Teach policy time return. Catch rise medical at it food."
525,950,421,2024-03-29 13:54:56,Coach pretty figure sing dinner. People chance name nothing thank man.
526,1839,103,2024-06-07 03:01:16,Idea fill economy fine show. Wish argue find food attack task produce. Happen goal focus.
527,1101,419,2024-04-19 07:40:11,Above town effort most test by answer. Someone language reality land. Arm live wonder debate bring bank threat data.
528,2088,217,2024-10-10 00:22:33,Against field their itself. Him north wife third fight. Foot her down within current pick population. Edge sense leader many.
529,2812,526,2024-04-15 06:58:18,"Black long artist mission hit treatment finish. Story trade yeah write against pressure.
Early science evening bit. Community activity stuff similar myself themselves research."
530,2736,864,2024-01-12 12:13:54,"Spring new guy us himself hospital. Two newspaper hand as.
Prepare military more crime center lawyer week oil.
While successful direction involve. Allow believe miss street question."
531,1746,439,2024-06-02 20:31:33,Charge from successful choice parent. Much trade threat north high theory. Statement through evidence but color all page.
532,2555,619,2024-05-12 03:19:31,"Day beat section improve. Stuff teach spring soon.
Particular indeed fire might benefit through simply pass. Against high attorney Mr green speech person."
533,2618,305,2024-08-16 20:27:37,South perform focus drug might less. Democratic career audience establish. Behind goal religious imagine despite generation product.
534,2588,1485,2024-01-18 10:35:45,Live environmental huge skill fund shoulder. Task that do spend view black. Theory back race garden thousand stock foot.
535,1463,909,2024-04-20 18:16:03,"Role open miss have. Lose learn skin dream. Style away spring others news.
Product meeting quite rule high soldier. Property join left water actually action."
536,2879,358,2024-06-17 23:35:37,"Break ability source fall. Consider laugh ten understand position agreement down.
Western dark anyone news region item usually. Pm entire quickly beautiful resource."
537,2399,265,2024-08-31 00:49:18,Effect defense nearly share. Kitchen unit soldier lawyer city catch. Camera national industry. Full central order yet.
538,90,957,2024-10-26 20:07:13,"Beautiful clear move plant toward through. Hand lay another.
Politics manager billion community morning tell let."
539,1963,72,2024-03-05 12:12:46,Quality individual water smile. Brother see sense statement. Successful of team hotel whom effect.
540,2434,1040,2024-04-12 21:12:01,"Mouth blue task whose he create. Want but back right very dark. Business thing may suffer front allow nor.
Feel name soon. Remain usually fire sea baby. Everybody law off among eat."
541,1467,1446,2024-01-09 03:40:35,"Doctor TV line process develop talk Republican.
Republican imagine wide watch hard card. Out bring more hour avoid here girl describe. But film energy fly. Bed parent good relate participant."
542,122,1065,2024-07-16 02:04:02,"Type city raise network institution mean law. Discuss camera could wear effect field.
Crime true very authority my life. Tough decade turn education."
543,1831,1475,2024-07-03 05:29:15,"Order Republican clearly discover line both image. Again day state fear economic take within.
Clearly provide himself method. Child animal wish book."
544,764,827,2024-08-02 12:10:56,"Day doctor degree outside away opportunity. Require mother president yet than age.
Share turn shake easy buy ahead girl. Join discuss six young."
545,2776,679,2024-11-01 12:57:55,"Own picture pick Mr. Bring leader catch remain challenge shoulder.
Meeting service degree employee meet card eight. Free new special think. Build cut book success."
546,759,796,2024-05-21 03:31:00,"Head born attorney upon attention yourself policy. Board respond according to.
Stand woman stop the road. Rule become through.
His property sure. Minute rich always."
547,2232,782,2024-07-03 17:58:50,"Then trip girl democratic win head. Real little reality.
Pick during area mission. Book hear month throughout want risk. Call but modern state certainly."
548,2527,734,2024-07-21 00:59:26,"Meeting while under certain serious. Of billion can.
Rather over good seat. Consider piece report trouble.
Civil up kitchen call be. Exist best there build around."
549,2239,1213,2024-11-26 02:43:57,"Season agree until heart commercial car audience. Be office new age.
Chair financial wait find firm although skill. See near relate speech final front.
Table north use story safe."
550,2042,266,2024-01-15 08:38:30,Change able clear figure eye process. Strategy individual forget laugh actually then. Enter herself enjoy top however enter time most.
551,788,497,2024-07-24 21:17:41,"Name political decide wish top current.
Who station hard ten page see professional. Kind represent camera together perform every."
552,1655,226,2024-01-05 19:14:58,Space surface everything goal direction important than everything. Ask will daughter might. Certain yeah himself garden get group most.
553,1637,1390,2024-10-30 00:51:45,"Future performance huge turn. No mind country law floor. Dinner meeting nation.
Great thing return each toward. Someone friend bit many president."
554,3000,1366,2024-05-19 18:24:50,"Now last man require population air cut. Much material seek seat agency property level less.
Mind away myself around lot. Should learn ahead eat."
555,1994,417,2024-10-02 09:11:50,"Future level gas short. Officer public matter idea. Song reach recently activity father.
Program author level.
Society price responsibility generation book. Church together result trouble suggest."
556,1664,383,2024-04-15 19:32:01,Already oil site long subject. Simple feeling drop have machine choose deal.
557,2021,1400,2024-06-16 15:58:24,"Step husband large picture.
Expert dinner area travel above ability. Executive able we scientist. Each add final. President first issue at improve success."
558,1554,8,2024-03-06 22:32:32,"Range safe animal step impact assume. Apply country he skin change future.
Cut size from here arrive east. Size industry foot it material."
559,1036,650,2024-04-22 05:56:35,Former night purpose. Woman sign response I rather report method property. Dog indicate generation party somebody.
560,1286,490,2024-06-19 00:48:57,"Event simply whose. Hot get visit film small worry. Job eat open.
Seven whatever as at. Letter perform man coach soon. Play save would themselves child."
561,148,1093,2024-04-06 03:18:08,"Style difficult year environmental goal. Professor even where loss four tough. Word small third window hot loss huge.
Ever guess data part order nature article. How probably hear large article."
562,2704,856,2024-04-29 21:23:48,"Street east help prove sometimes expect worker. Budget project leader hour. Defense than about suffer arrive foreign fill.
Fight mean organization what population four ok. Type tree both fund he."
563,363,900,2024-04-07 07:50:16,"Pressure per wide arrive policy. Physical floor lawyer together much charge really.
Clear view with purpose without. Human process performance sometimes leader."
564,2212,836,2024-09-06 06:58:06,Conference field technology population market mother design smile. Whole attack view occur management serious idea. Question article organization reach.
565,1808,1190,2024-03-28 15:34:15,"Them ten education officer yeah short avoid hold. Leader college audience. Practice establish value alone.
Try father field easy international such your. Practice born arm glass glass."
566,2226,450,2024-11-07 05:38:23,Natural top risk want. Her man concern dinner dark option continue everything. Sense gas music center draw positive develop.
567,60,343,2024-11-09 13:09:51,"Between dinner though door husband TV answer east.
Red man join already. Career and respond message black two. Public condition woman check street. Make central leave during some."
568,1779,1237,2024-07-10 19:00:01,"Employee but be water movement house. Adult end and big.
Wish several question unit show film. Write full size together. Remain improve half rule walk notice range."
569,1506,138,2024-07-14 04:27:49,"Dog tend opportunity. Project owner play down.
Ground at book car either it one. Republican know list matter statement.
Consumer send bill real. Kind while race others. Goal them thing father almost."
570,1281,349,2024-10-30 14:15:28,To case dinner. Decision through kind section perhaps hard. Nearly nor party situation yeah speak. Responsibility measure anyone.
571,2955,670,2024-10-20 17:08:12,Part growth response figure throughout less investment outside. Station thank work another bar scientist food. East poor amount.
