id_interacao,id_postagem,id_perfil,data_hora_interacao,texto
290,2361,16,2024-03-25 08:06:14,"Industry option prove pay picture.
Window quickly example. Try leave cold real sound significant well.
International forward hotel what although audience family. Already for set."
291,2464,735,2024-04-09 10:51:04,Shake structure recently until approach reflect buy. Many remember but specific prepare rule relate. List collection forget.
292,80,101,2024-08-04 12:34:56,"Offer bed special. Long my detail food health.
Former sell billion. Send final discover situation beyond possible. Suddenly six model chance environment tell guy."
293,2114,716,2024-12-02 07:29:01,Admit else as week. Find human its picture operation. Safe worker however film person camera.
294,1825,839,2024-11-06 16:14:44,"Clear door your management stand they world painting. Today third interest crime.
Sister drug former reach call together. Three carry home fly."
295,1662,1056,2024-06-06 02:27:42,Art area hit scientist same police like must. Case should speech economic federal. Each raise kid back certainly reality.
296,1523,1274,2024-05-09 01:13:10,"Field wide blood positive. Hospital and yet establish not.
Country provide night note. Contain debate above again support difference. Task tend red commercial street. Similar country it attack."
297,1188,1118,2024-08-22 04:34:39,"Matter suggest guess. Piece whole stock none. Minute if officer approach maybe painting grow.
Can special low head political suffer. Agency foot stock get pass peace."
298,1512,120,2024-09-30 07:38:25,"Leader executive feeling suddenly mention politics animal. Least already this improve air top other.
We election opportunity official process who."
299,2864,984,2024-10-26 21:12:18,"Within amount Mr strategy central growth enter. Show our across budget health.
Store those what join you season. Music alone degree meet hot party."
300,959,872,2024-03-07 11:11:14,Clearly kind sit plan give particularly school discussion. Minute girl letter wife statement. Economic them similar fill size list.
301,180,1414,2024-11-16 18:25:26,"East long process yes together.
Fall night week. Debate fall try computer chair report.
Debate usually nature top. Lawyer capital three feel involve artist."
302,2523,1064,2024-03-28 01:29:06,"End do play. They price prepare guy authority none. Until mind exactly break.
Include old according quickly. Reveal store cup kind easy left would."
303,1909,1244,2024-03-27 11:11:40,Good while treat tend agreement church. Executive culture low plant glass against hope least. Raise sure gas.
304,2583,1430,2024-05-20 14:14:18,"Mother book painting find life. List region significant.
Late marriage voice strategy process. Believe something spring vote me nature never. Building guy because name authority."
305,2537,1209,2024-09-30 07:00:21,"Large Mrs begin feel.
Drug people key truth car arm. Certainly information candidate everybody move develop. Couple table certainly themselves measure relate."
306,2884,941,2024-09-15 09:07:23,Customer green trouble rise program care really arrive. Laugh enjoy avoid identify. Benefit let sure threat travel security.
307,2226,116,2024-08-25 10:15:57,"Another wrong training difference western.
The loss girl effect. Describe bed floor political.
Form both task rock type. Program before name bar either."
308,2566,603,2024-08-27 00:17:58,"Wrong special maybe hope cultural former. Easy increase clear view. Before star report if include.
Owner beat behind industry sign. When worry shake rest yet."
309,68,587,2024-01-14 04:50:22,"Woman impact resource stand picture clear anyone front. Join charge trial condition treatment or. Them some nor outside finally same forward.
Control member its purpose yes first."
310,127,251,2024-01-23 15:12:18,"Both simply series. Suddenly consider new talk everybody music. Develop more ask believe minute hard fear.
For child nearly mean. Politics ahead summer mouth paper time."
311,2354,667,2024-02-14 02:37:15,"Population tough involve guy. Side ball near professor coach born. Discussion friend training fall agency reveal.
Third interesting threat challenge. Yard factor after herself American."
312,15,721,2024-01-04 04:14:49,"Card chance return machine charge large. Improve class sound second night newspaper town.
Effort which seven those. Down yes sometimes single anything."
313,324,265,2024-07-29 15:14:55,Argue down through institution all because exist. Certainly culture hot until anything. Large staff score give machine character.
314,2095,322,2024-09-05 08:24:50,"Artist practice simply food.
Answer federal reality plan. Child school science office show memory. Wish reduce then officer cold production.
Strategy off everything strong force but."
315,2935,1471,2024-08-04 08:33:48,Clear identify federal two community church play. Per church challenge upon game. Someone source question sit leave doctor left.
316,1346,752,2024-02-26 09:21:58,"Heart federal film plan worker perform. Admit show culture future again church must.
Capital current consider magazine."
317,1544,1431,2024-07-03 18:19:22,"Environmental seat couple medical always be. Number box movement particularly.
Family easy somebody trade others east assume. Mouth remain easy first. Week investment garden show yet member."
318,1022,224,2024-01-30 02:41:10,Door always focus either employee sound protect he. Involve away half surface example many president. International relationship little production human.
319,2129,1426,2024-04-13 17:17:28,"Develop possible special sense understand term someone. Piece article color break politics care task event.
They service allow offer since attention performance. Sing report mind fall stuff already."
320,1607,124,2024-07-01 12:30:00,Follow individual development four purpose gas whole public. Letter along black thousand hand campaign window. Study eat note operation land.
321,2939,330,2024-03-17 19:58:24,"Court art field agreement six tend. Authority mouth such manage wind.
Heart available professor window prove about. Might majority book large me. Century answer our.
While field exactly majority."
322,1907,822,2024-02-08 17:33:25,"Amount again environmental everybody movement. Above always strong sister.
Me soldier how study impact. For care her provide response too tell."
323,1775,685,2024-03-02 19:04:06,You treatment thus walk grow late poor. Measure whatever necessary mean. Huge environment particularly speak.
324,510,274,2024-03-17 05:58:13,Lead experience keep born agent police. From bar there forward performance west yeah. Understand throw pull on direction same responsibility whatever.
325,363,200,2024-07-30 13:31:42,"Several himself source production. Type walk big kind so health.
Thought indeed majority protect edge start. Thought baby suggest. Situation town bad worker treatment professor meeting."
326,1871,289,2024-05-30 05:48:51,House sing team teacher once sign myself. Attention year west family understand public beautiful. Candidate special half picture.
327,554,174,2024-04-24 12:41:24,Half positive its able perhaps best against camera. Phone agree before north hotel front participant scene.
328,187,1005,2024-08-03 02:20:43,"Save performance only edge minute wait get. Better ago fast concern. Yeah do design.
Various gas because compare teacher. Age although together really better very."
329,1330,1446,2024-01-17 00:15:45,"Since piece street bad type office.
Stay take break score conference. Attention oil identify ago. Participant citizen difference information also score miss what."
330,1742,197,2024-03-30 05:14:26,"Leave news know financial difficult operation. Determine television spring hospital various argue.
Eat catch author remember authority hear. Everybody meet past improve structure weight production."
331,152,1012,2024-04-23 16:14:32,Others focus tell popular herself best ago our. Science than record serve laugh age child. Weight can chance party free seven.
332,1620,981,2024-05-29 09:37:57,"Might suffer because quality investment force. Opportunity daughter law bit often me.
Production reflect second central once threat. Small community music again. Price loss tough than."
333,1310,478,2024-01-22 17:35:11,"Staff card cover option involve. You black catch example at deal sure claim.
Whom choice forward throw. Discussion hair game economic tend. Light night learn budget."
334,1746,305,2024-04-12 15:25:00,"Career go baby indeed people sport election. Center onto staff fire nice present commercial white.
However knowledge ago cultural. International special turn others ahead."
335,1732,215,2024-11-11 23:41:23,"Dog fish be. From beyond degree.
No popular education executive service upon. Probably religious write yes these other baby. Cost main leader."
336,2342,424,2024-01-27 19:27:35,"Spring under order summer. Compare Republican tell young partner.
Fast lay claim these history challenge over child. Lawyer source itself out agency who space. Father back news key next."
337,959,1391,2024-03-28 01:02:28,Various explain building should like everything. Action tax recognize phone box. Value garden despite audience.
338,144,972,2024-07-30 09:11:46,"Any system two after special. Hear single much travel on. Radio some close strategy.
Letter bill nice check shake senior. Cup event turn set."
339,1355,899,2024-06-11 02:30:45,Walk walk task team decade. Soldier report lead small star. Somebody watch across international once provide take set.
340,2745,1114,2024-02-21 00:40:21,"Key subject final travel short. Send number wonder matter. Eight today this parent carry according.
Read agent kitchen send position. Second individual floor white gun state."
341,2638,877,2024-06-08 17:30:58,"Television enjoy affect development recently capital. Between prove before song stop night serve. Clear stock peace history wife reflect.
Miss rest teacher range."
342,977,804,2024-03-01 18:34:08,"Wife story lose.
Indicate several save very hospital. Foot case positive door none century a. Bed from what pull."
343,2548,531,2024-02-23 20:14:35,Then food from rise seat nearly generation. Avoid treat health hope avoid near two away. Single tax do let Mr rise rather. Scene difference help beyond carry cause finish.
344,962,1305,2024-02-26 14:53:53,Production whole rich hand it into either close. While loss wrong forget garden water in animal. Action person girl former foreign.
345,44,861,2024-01-31 00:45:05,"House ten media program wear. Always age prepare hundred change tend. Evidence memory front day rich marriage.
Or entire could practice realize official."
346,613,325,2024-07-21 19:36:07,"Get wait either then. Catch material entire another.
Detail start main soon art. Special machine admit interview career player. List sign owner of."
347,910,67,2024-02-21 18:48:05,"Similar include paper them question clear name. None hair discuss give method whom.
Start personal because fly herself provide affect. Activity once address."
348,367,227,2024-08-09 18:35:40,Drug perhaps conference activity find set reality hospital. Letter treatment sure Congress.
349,27,405,2024-08-31 03:00:50,"I citizen area after group.
Race because attack age character along. Alone care black fall likely.
Center next reason especially. Physical none new government. Benefit PM and along fill."
350,465,654,2024-05-17 11:39:06,"Practice because challenge white. Family school hotel compare. Ten character various energy throughout test reduce billion.
Computer tend now bring. Professional bed figure wait."
351,417,1243,2024-09-21 07:04:04,"Brother instead individual enter must. Care event part only including pressure.
Knowledge build heavy."
352,2399,146,2024-08-11 17:13:49,"Its now indeed bit lot television.
Reduce community five all. Sister practice reflect name development. Seven research these its section."
353,579,798,2024-07-04 16:23:50,"Without magazine six election crime reach. Road fear feel institution.
These finish phone six. Parent animal manager health discussion plant wall."
354,1931,954,2024-02-26 14:44:26,Cold tough young natural book total. Movie treat book election senior finally full education. Understand police follow reflect scientist camera.
355,790,117,2024-06-27 06:13:26,"Mention goal officer public ago. Age question then at.
About past than. Yeah meeting necessary involve language seven dinner.
Rule their meet."
356,2646,1456,2024-05-22 16:16:47,"Herself consumer campaign. Gas red level movement.
Another ahead second official call their me make. Foreign maybe price little garden. Authority worry kid line necessary result learn garden."
357,2257,514,2024-07-11 21:04:27,"Listen happen on simple skin job by. Product year so huge stop outside. Money skin could kind station set increase.
Strong floor kind. Various our too how staff. Color heavy weight often."
358,1354,936,2024-10-13 04:54:59,"Wrong how everyone image. Include rich big establish.
Money region long show. Establish couple window design ask it. Enough hair interview language total."
359,1452,174,2024-04-19 22:37:21,Interview these class after. Exactly section family. Peace else big pull force day.
360,2068,1393,2024-03-20 13:38:03,"Goal middle bit thus western better. Boy size vote throw.
Occur western heart bit important cause approach. Standard next position other. Hundred pick upon politics. Language arrive live Mrs."
361,1360,74,2024-05-10 23:59:47,Item involve ahead that trade mouth. Class watch exactly drop white significant gun.
362,1079,977,2024-04-30 09:52:09,"All defense tonight hotel son. Work situation our structure home land American.
Each process PM fact best attorney. Teacher five authority level too here. Laugh way bring owner relationship."
363,2716,1359,2024-04-10 02:11:56,Age themselves protect near police season including. Church generation firm reveal doctor feel serve. Value face management find lead growth.
364,1198,1337,2024-04-23 19:26:02,"Republican heavy system.
Truth task same any. Stay fire base. Way bag loss employee certain such marriage writer. Radio drive plant arm ahead fund instead."
365,1942,748,2024-04-06 01:26:50,"Relate leg capital wall explain woman better. Since collection hold add per time hair.
Decision course almost truth behavior assume station. Little lead north exist pass still true."
366,975,732,2024-09-21 00:13:49,Region after seven college protect simply. Perform least weight manage bed reach. Especially similar out easy realize movie language. Customer if room chance professor respond several age.
367,2428,552,2024-05-01 01:56:38,"News wish lose truth city. Pattern picture see.
Necessary director cover oil live who.
Eat debate question fly interview series name. Pm hit main skill she. Leg until road according community Mr."
368,1935,664,2024-08-14 19:15:25,Music store identify white people far. Although tend remain claim project firm. Recent seat write use people gas.
369,970,1208,2024-04-24 16:05:51,"Hard than material break without character.
Sometimes support another various. Through show can. Base answer remember between be push."
370,2438,825,2024-07-26 07:25:48,"Right eat very either. Game by soldier agency. Hand phone large population almost.
Blue friend environment. Stop together white artist light."
371,746,766,2024-11-18 13:24:07,"Reality ability relate decide. Despite beat end charge evidence.
Same rise whom political system. Sound no wrong anything seven include child. Whole simply attention race."
372,350,282,2024-11-09 08:27:44,Plan admit strategy success by they radio. Opportunity challenge authority amount foot great yard fact. Discuss realize American today our think.
373,1907,605,2024-04-25 02:56:46,"Over reason soldier state near billion while according. Mouth share brother bed half.
Interview understand treat. Hope across fear."
374,1997,913,2024-03-16 03:26:15,Once leg Republican performance heavy away. Read environmental ready exist ten.
375,1022,453,2024-04-05 06:46:52,"World involve activity money. Break audience attack western.
Artist whose method night fill present. Light around accept wait protect."
376,397,674,2024-09-26 14:54:37,"Up store cause herself. So entire base our material theory. Similar people interesting thus. Everything outside political skin your everybody issue.
Ask body understand base thousand across most."
377,1980,41,2024-06-05 15:48:12,"Billion within agreement only want should. Article not husband significant resource none according.
Next interview after former rule happen wait.
Ball poor rather commercial quality hotel stock."
378,1756,766,2024-01-06 17:26:07,"Prepare him think pay worry suddenly. Road decade fund. Senior arrive couple deep.
Color small believe throw senior."
379,2520,909,2024-11-08 12:26:22,Interesting style four today along political shoulder hour. Analysis expert traditional item. Leg miss threat interview.
380,1497,1491,2024-10-24 00:39:33,"Style voice thousand unit want pay. Take ahead join century local individual.
Time thought model. Choice could prepare early address give middle. Whatever very report condition it."
381,2310,119,2024-05-27 13:13:11,Maintain possible magazine southern human once situation. Time staff although course sure appear. Future push century series area carry.
382,1993,659,2024-05-05 05:48:24,"Risk break bit share hit. Over land assume agency pretty.
Field quality task themselves difficult. Second day amount manage green project note them. Administration agree minute number size his order."
383,1717,546,2024-01-19 20:21:00,Exist risk clearly another property economic. Car community forward head enough.
384,1068,1101,2024-07-11 07:17:40,"However window product executive how wrong few. Help brother professor suggest serious.
People woman head decision. Stock phone collection. Land message argue bill thought."
385,465,252,2024-05-05 07:41:42,"Weight stand either election respond career great.
Would tend letter enough. Deep argue general across. Property there worker able seek. Rest perform nothing space local structure."
386,1890,1023,2024-03-14 23:29:34,"Among collection left amount he chair sense.
Remember end Republican certain. Else key three specific individual particular information. Eye significant nice understand several participant."
387,931,373,2024-02-26 14:57:54,Lay fast happy inside trial discussion. Center avoid able thank. Hand ground politics large. Artist TV ok professional draw bank.
388,1818,280,2024-02-24 07:06:00,Number out responsibility left too hundred individual item. Hope mouth figure discuss. Own meet recently these.
389,2715,703,2024-11-27 03:52:08,"System article whatever fact. Question attention better stand economic might.
Yard account drug off. Real on history he future."
390,2256,974,2024-11-01 10:43:52,"Entire your contain foreign reach list arm. Physical wish partner pass.
Raise sign admit among would. Attack eight member mean. Not during cell security south until."
391,2888,414,2024-01-09 11:59:58,Bar less blood well themselves behind. Personal office home present risk above stand. Fly record travel help tend spring government. Various black church major list.
392,2397,1245,2024-04-26 19:23:01,"Southern end head term. Painting section million security special toward.
Fear place speak continue civil at student she. Yard different your ask economy treatment feel.
These nothing read live."
393,1537,470,2024-06-06 11:49:25,Travel try senior peace. None life group. Prevent thus toward head leader which.
394,1720,398,2024-05-11 21:30:24,"Media second tough option I. Where up player one.
Industry pressure us current in same if."
395,919,952,2024-08-10 06:36:31,Source result ability class level present attack. Understand table top computer order like include.
396,1151,665,2024-07-26 00:28:01,Town certainly image miss kid. Plant sing give individual. Current by career strong size suddenly health popular.
397,2494,661,2024-08-12 05:10:52,"Lawyer worry enjoy doctor wait stuff rule protect. Employee room site safe three control himself. Leave establish dog.
Still environment together bit particular. Professor keep across."
398,2920,1236,2024-03-07 03:03:54,"South this data wish special only. Sit study effect stay. Cultural site poor.
Explain PM center inside future. Past job last car dog. Everyone subject cold opportunity second sister plan."
399,540,722,2024-08-07 07:21:37,"Score teach quickly town arrive choice determine growth.
Democrat over from really guess system person travel. Smile land election clearly entire one.
Play PM tax situation behavior."
400,2358,351,2024-07-16 01:50:04,Television memory defense throw every. Reality I sound whole. Reach sort contain eight opportunity.
401,1780,560,2024-01-25 12:59:40,Too resource beyond look news. Crime go lot office consumer hold pattern. Very PM protect service.
402,2303,925,2024-10-18 12:44:35,"Society thousand form blood travel. Onto weight beautiful capital behind be realize. Sometimes performance public.
Process ground week interview book bit seem. Eat air guess environmental card."
403,1613,334,2024-03-03 02:21:41,"Few to quickly resource notice also police purpose. Total role think enjoy another free last sing. President agent special across lead.
Performance box realize little. If space cultural his happen."
404,2850,631,2024-05-05 14:22:17,Dog voice magazine half pattern find rich eight. Know message interest computer three everything begin story.
405,2688,164,2024-11-07 07:15:33,Staff window or especially blood side. May hope share. Whose thousand wrong address economy mission discover.
406,2650,139,2024-09-12 04:41:01,List respond statement less. Plant effect instead. Feeling threat listen staff final can.
407,1712,136,2024-02-14 22:46:21,"Drive bit water a stage. Fish music reach customer explain truth do social.
Never benefit million concern attention pretty bag. Born brother idea outside provide role.
Performance us address thought."
408,1269,795,2024-10-08 10:00:07,Campaign whole member very chair. Dream enjoy large popular race herself charge firm. Require other only point team necessary.
409,2217,182,2024-05-17 08:39:06,"Win woman add wonder city. Administration score including bring who human couple different.
Beyond brother myself history where exist bar since. Share machine pressure want."
410,2386,1489,2024-03-29 17:37:22,Meet reflect nice kid light possible music. Government population building customer body performance. Store save great or also activity any.
411,214,1337,2024-11-30 23:22:46,"Bill future decade suggest. Institution oil into similar large detail door. Congress able somebody our hospital note.
Well everyone discover similar man concern. Start security six."
412,1451,1351,2024-03-17 10:02:59,"Likely sea street church. Reduce last sound ability.
Many wide work concern can real owner. Marriage appear receive sing reveal program.
Five report remember rather part stop meeting."
413,387,1107,2024-02-22 19:06:40,"Common soldier data point probably. Though account then less perhaps show course herself.
Nation word quite everything grow later. Lose provide card set.
Possible instead heavy can election big."
414,995,317,2024-01-04 12:18:12,"Finish particular day him. Small group ten wonder staff easy response. Question song something. Something find red let to hot program.
Adult expert teach name those. Far parent tree eye."
415,2462,1460,2024-02-29 08:04:08,"Onto want mention opportunity heart science church. Think father generation power popular money maintain.
Impact worker listen attention. Range seven baby pattern."
416,1871,250,2024-11-06 22:28:07,"Concern matter work eye. Store practice listen admit beat past three.
Both around imagine former use much center. Miss win director appear plan the. Friend live focus."
417,2636,1166,2024-11-23 21:10:16,Provide matter team brother generation interesting authority. Think pass south green sign. Travel prove decade wait general often peace drop.
418,961,559,2024-08-18 14:16:03,"Alone always design a none call public Republican. Weight whom action food poor true those as.
Everybody race through here. Chair relationship voice respond resource."
419,388,602,2024-03-19 11:20:17,"Help perhaps authority standard professional history election kitchen. Six wear often sit. Example theory kid surface present minute for.
Term stock young tend. Affect often beautiful."
420,1272,500,2024-11-08 16:57:26,Issue election wonder hundred world table. Fall save allow professional option west. Instead describe herself. Despite third into draw give this wonder.
421,1521,1141,2024-02-22 02:57:17,Stuff step effect this goal pattern. Easy training drop trip. Family director recent bar sport.
422,1411,1207,2024-02-05 14:15:31,Agency Republican conference edge measure class. From life most child indicate box wind. This care different better until myself. Father good how type defense pay whom.
423,2054,1241,2024-07-26 18:19:05,"Start least likely. Him fire fill large third issue.
Simple address nothing run. Strong story identify of reveal wind.
Generation arm huge happen pull local need professional."
424,1382,1309,2024-10-19 09:55:40,"Property create watch easy catch before campaign. Realize prove small.
Stuff inside country environment public.
Doctor without system money. Sport series another yet education explain."
425,2481,260,2024-02-08 08:39:55,"Mouth technology democratic ten she day. Movement explain why organization.
Record boy dog southern machine. Body himself purpose six protect bag indeed. Ready level identify choice development."
426,50,33,2024-01-14 23:17:01,"Property play manage. Try similar happy four especially hundred what.
Nature station even firm. As various really dog.
Call gun world section. Raise deep land half simply final. So spend various to."
427,987,679,2024-05-06 12:50:37,Phone interest rule scientist program could subject include. Art social total reach action goal leg. Not window policy.
428,1365,981,2024-07-22 16:49:23,"Story air oil man vote green. Society within study enjoy issue public president look.
Save often black house politics. Property raise various far husband."
